{
  "horse": "example-value",
  "horse_id": "991369",
  "age": "example-value",
  "sex": "example-value",
  "sex_code": "gb",
  "colour": "example-value",
  "region": "gb",
  "dam": "example-value",
  "dam_id": "280873",
  "sire": "example-value",
  "sire_id": "614815",
  "damsire": "example-value",
  "damsire_id": "905592",
  "trainer": "example-value",
  "trainer_id": "558604",
  "owner": "example-value",
  "owner_id": "785065",
  "number": "example-value",
  "draw": "example-value",
  "headgear": "example-value",
  "lbs": "example-value",
  "ofr": "example-value",
  "jockey": "example-value",
  "jockey_id": "413616",
  "last_run": "example-value",
  "form": "example-value"
}